{
  "$schema": "http://json-schema.org/draft-07/schema#",
  "$id": "https://github.com/WasmAgent/agent-trust-infra/specs/agentbom/agent-listing-schema.json",
  "title": "AgentListing",
  "description": "Agent Listing v0.1 — marketplace schema for publishing discoverable agents with trust metadata",
  "type": "object",
  "required": ["listing_version", "agent_id", "metadata", "discovery", "marketplace", "trust_artifacts", "publication", "attestation"],
  "additionalProperties": false,
  "properties": {
    "listing_version": {
      "type": "string",
      "enum": ["0.1"],
      "description": "Always 0.1"
    },
    "agent_id": {
      "type": "string",
      "description": "Unique agent identifier (MUST match identity.agent_id in referenced AgentBOM)"
    },
    "metadata": {
      "type": "object",
      "required": ["name", "description", "version", "author"],
      "additionalProperties": false,
      "description": "Agent metadata including name, description, version, and author information",
      "properties": {
        "name": {
          "type": "string",
          "description": "Human-readable agent name"
        },
        "tagline": {
          "type": "string",
          "maxLength": 100,
          "description": "One-line summary (≤ 100 chars)"
        },
        "description": {
          "type": "string",
          "description": "Full description (markdown supported)"
        },
        "version": {
          "type": "string",
          "description": "Semantic version"
        },
        "author": {
          "type": "object",
          "required": ["name"],
          "additionalProperties": false,
          "description": "Author or publisher information",
          "properties": {
            "name": {
              "type": "string",
              "description": "Author or organization name"
            },
            "email": {
              "type": "string",
              "format": "email",
              "description": "Contact email"
            },
            "website": {
              "type": "string",
              "format": "uri",
              "description": "Author website URL"
            }
          }
        },
        "repository": {
          "type": "string",
          "format": "uri",
          "description": "Source code repository URL"
        },
        "homepage": {
          "type": "string",
          "format": "uri",
          "description": "Agent homepage or documentation URL"
        }
      }
    },
    "discovery": {
      "type": "object",
      "required": ["category", "tags"],
      "additionalProperties": false,
      "description": "Discovery and search metadata including category, tags, and screenshots",
      "properties": {
        "category": {
          "type": "string",
          "description": "Primary category (e.g., data-analysis, automation, customer-support)"
        },
        "tags": {
          "type": "array",
          "minItems": 1,
          "items": {
            "type": "string"
          },
          "description": "Searchable tags"
        },
        "keywords": {
          "type": "array",
          "items": {
            "type": "string"
          },
          "description": "Additional search keywords"
        },
        "screenshots": {
          "type": "array",
          "description": "Screenshots and demo media",
          "items": {
            "type": "object",
            "required": ["url", "type"],
            "additionalProperties": false,
            "properties": {
              "url": {
                "type": "string",
                "format": "uri",
                "description": "Screenshot or media URL"
              },
              "caption": {
                "type": "string",
                "description": "Alt text or caption"
              },
              "type": {
                "type": "string",
                "enum": ["image", "video", "demo"],
                "description": "Media type"
              }
            }
          }
        }
      }
    },
    "marketplace": {
      "type": "object",
      "required": ["license"],
      "additionalProperties": false,
      "description": "Marketplace-specific fields including pricing, downloads, and rating",
      "properties": {
        "pricing": {
          "type": "object",
          "required": ["model"],
          "additionalProperties": false,
          "description": "Pricing and licensing information",
          "properties": {
            "model": {
              "type": "string",
              "enum": ["free", "paid", "freemium", "enterprise"],
              "description": "Pricing model"
            },
            "amount": {
              "type": "string",
              "description": "Price (e.g., $99/month, $0.01/call)"
            },
            "currency": {
              "type": "string",
              "pattern": "^[A-Z]{3}$",
              "description": "ISO 4217 currency code"
            }
          }
        },
        "license": {
          "type": "string",
          "description": "License type (e.g., MIT, Apache-2.0, PROPRIETARY)"
        },
        "downloads": {
          "type": "object",
          "additionalProperties": false,
          "description": "Download and installation information",
          "properties": {
            "total": {
              "type": "integer",
              "minimum": 0,
              "description": "Total download count"
            },
            "this_month": {
              "type": "integer",
              "minimum": 0,
              "description": "Downloads this month"
            }
          }
        },
        "rating": {
          "type": "object",
          "additionalProperties": false,
          "description": "Community rating",
          "properties": {
            "average": {
              "type": "number",
              "minimum": 0,
              "maximum": 5,
              "description": "Average rating (0-5)"
            },
            "count": {
              "type": "integer",
              "minimum": 0,
              "description": "Number of ratings"
            }
          }
        }
      }
    },
    "trust_artifacts": {
      "type": "object",
      "required": ["agentbom"],
      "additionalProperties": false,
      "description": "Links to AgentBOM, Trust Passport, and compliance reports",
      "properties": {
        "agentbom": {
          "type": "object",
          "required": ["url"],
          "additionalProperties": false,
          "description": "Link to AgentBOM",
          "properties": {
            "url": {
              "type": "string",
              "format": "uri",
              "description": "AgentBOM JSON URL"
            },
            "hash": {
              "type": "string",
              "pattern": "^[a-f0-9]{64}$",
              "description": "SHA-256 hash for verification"
            }
          }
        },
        "trust_passport": {
          "type": "object",
          "required": ["url"],
          "additionalProperties": false,
          "description": "Link to Trust Passport",
          "properties": {
            "url": {
              "type": "string",
              "format": "uri",
              "description": "Trust Passport URL (signed JWT)"
            },
            "issuer": {
              "type": "string",
              "description": "Passport issuer DID or URL"
            }
          }
        },
        "compliance_reports": {
          "type": "array",
          "description": "Compliance mappings and attestations",
          "items": {
            "type": "object",
            "required": ["framework", "url", "status"],
            "additionalProperties": false,
            "properties": {
              "framework": {
                "type": "string",
                "description": "Framework name (e.g., SOC2, ISO27001)"
              },
              "url": {
                "type": "string",
                "format": "uri",
                "description": "Compliance report PDF or JSON URL"
              },
              "status": {
                "type": "string",
                "enum": ["compliant", "partial", "non-compliant", "pending"],
                "description": "Compliance status"
              }
            }
          }
        }
      }
    },
    "publication": {
      "type": "object",
      "required": ["publisher", "published_at", "updated_at", "status"],
      "additionalProperties": false,
      "description": "Publisher information and publication timestamps",
      "properties": {
        "publisher": {
          "type": "object",
          "required": ["name"],
          "additionalProperties": false,
          "description": "Marketplace publisher information",
          "properties": {
            "name": {
              "type": "string",
              "description": "Publisher name"
            },
            "did": {
              "type": "string",
              "description": "Publisher decentralized identifier"
            },
            "email": {
              "type": "string",
              "format": "email",
              "description": "Publisher contact email"
            }
          }
        },
        "published_at": {
          "type": "string",
          "pattern": "^\\d{4}-\\d{2}-\\d{2}T\\d{2}:\\d{2}:\\d{2}(\\.\\d+)?(Z|[+-]\\d{2}:\\d{2})$",
          "description": "First publication timestamp in ISO 8601 format"
        },
        "updated_at": {
          "type": "string",
          "pattern": "^\\d{4}-\\d{2}-\\d{2}T\\d{2}:\\d{2}:\\d{2}(\\.\\d+)?(Z|[+-]\\d{2}:\\d{2})$",
          "description": "Last update timestamp in ISO 8601 format"
        },
        "status": {
          "type": "string",
          "enum": ["published", "archived", "deprecated", "pending-review"],
          "description": "Listing status"
        }
      }
    },
    "attestation": {
      "type": "object",
      "additionalProperties": false,
      "description": "Listing signature, hash, and verification endpoints",
      "properties": {
        "listing_hash": {
          "type": "string",
          "pattern": "^[a-f0-9]{64}$",
          "description": "SHA-256 of canonical listing JSON"
        },
        "signature": {
          "type": "string",
          "description": "Publisher signature over listing_hash"
        },
        "signature_algorithm": {
          "type": "string",
          "enum": ["rsa-pkcs1-sha256", "ecdsa-secp256k1", "ed25519"],
          "description": "Algorithm used"
        },
        "verification_url": {
          "type": "string",
          "format": "uri",
          "description": "Endpoint to verify listing and trust artifacts"
        }
      }
    }
  }
}
